{
  "contentSha256": "d2171bfd5ab1590044eff36dcdeeedc74ea461ef633d021d63e07267f25b43ac",
  "excluded": [],
  "fileCount": 186,
  "generator": "tileforge-proto/0.4.0",
  "importedAt": "2026-07-31T21:27:51.103Z",
  "lockFormat": 1,
  "manifestFormat": 1,
  "manifestSha256": "c8b11de523115d4615d8c523770f87cf42cf3975bb9c682f0c484037437e467c",
  "packageId": "dusk-9b8b2a2-seed103991",
  "packagePath": "fixtures/tileforge-packages/dusk-9b8b2a2-seed103991",
  "packageSha256": "e09ea40e51f054f9fad6dad4cc96edd99a903ee2bff86f2a3e20e26cf57d84d6",
  "projectSeed": 103991,
  "provider": "TileForge",
  "sourceCommit": "9b8b2a2",
  "sourceLabel": "roadjoint transitions + road-extension types (sl-0058)",
  "strippedRoot": "tileforge",
  "theme": "dusk",
  "tileSize": 32,
  "totalBytes": 30258096
}
